{
  "$schema": "https://json-schema.org/draft/2020-12/schema",
  "$id": "https://metadax.daxfoundation.org/schemas/0.3/registry.schema.json",
  "title": "metadax.registry/0.3-x02-proposed",
  "type": "object",
  "additionalProperties": false,
  "required": ["schema", "course_id", "module_id", "updated_at", "nodes"],
  "properties": {
    "schema": { "const": "metadax.registry/0.3" },
    "course_id": { "$ref": "#/$defs/slug" },
    "module_id": { "type": "string", "pattern": "^L\\d\\d\\.M\\d\\d$" },
    "updated_at": { "$ref": "#/$defs/rfc3339" },
    "nodes": { "type": "array", "items": { "$ref": "#/$defs/entry" } }
  },
  "$defs": {
    "rfc3339": {
      "anyOf": [
        { "type": "string", "pattern": "^\\d{4}-\\d{2}-\\d{2}T\\d{2}:\\d{2}:\\d{2}(\\.\\d+)?(Z|[+-]\\d{2}:\\d{2})$" },
        { "const": "runtime" }
      ]
    },
    "slug": { "type": "string", "maxLength": 200, "pattern": "^[a-z0-9]+(-[a-z0-9]+)*$" },
    "conceptId": { "type": "string", "pattern": "^[a-z0-9]+(-[a-z0-9]+)*$" },
    "nodeId": { "type": "string", "maxLength": 200, "pattern": "^(L\\d\\d\\.M\\d\\d\\.O\\d\\d|n_[0-9a-hjkmnp-tv-z]{26})$" },
    "createdBy": { "type": "string", "maxLength": 200, "pattern": "^[A-Za-z0-9._-]+$" },
    "entry": {
      "type": "object",
      "additionalProperties": false,
      "required": ["id", "parent_id", "title", "canonical_question", "intent", "summary", "concepts", "depth", "visibility", "created_by", "superseded_by", "reuse_count"],
      "properties": {
        "id": { "$ref": "#/$defs/nodeId" },
        "legacy_id": { "type": "string", "maxLength": 200 },
        "parent_id": { "anyOf": [ { "$ref": "#/$defs/nodeId" }, { "type": "null" } ] },
        "title": { "type": "string", "maxLength": 80 },
        "canonical_question": { "type": "string" },
        "intent": { "anyOf": [ { "enum": ["clarify", "deepen", "example", "apply", "connect", "contrast", "challenge", "tangent"] }, { "type": "null" } ] },
        "summary": { "type": "string" },
        "concepts": { "type": "array", "items": { "$ref": "#/$defs/conceptId" } },
        "depth": { "type": "integer", "minimum": 1 },
        "visibility": { "enum": ["private", "pending_review", "accepted", "shared"] },
        "created_by": { "$ref": "#/$defs/createdBy" },
        "accepted_by": { "type": "array", "items": { "$ref": "#/$defs/createdBy" } },
        "contested": { "type": "boolean" },
        "contest_id": { "type": "string", "maxLength": 200 },
        "content_sha256": { "anyOf": [ { "type": "string", "pattern": "^[0-9a-f]{64}$" }, { "const": "runtime" } ] },
        "stuck_signature": { "type": "string", "maxLength": 200 },
        "superseded_by": { "anyOf": [ { "$ref": "#/$defs/nodeId" }, { "type": "null" } ] },
        "reuse_count": { "type": "integer", "minimum": 0 }
      }
    }
  }
}
